{"availabilityModel":"event-time-reference-assumption","calendarRef":{"id":"FixtureCalendar","sha256":"b9fa5cd6a5fa1592f7ff46acfa0b80c96f7cc442947fed22a3928be7256e8ea1","version":"v1"},"contextBindings":[],"id":"FixtureOrdering","schema":"frozen-quote-ordering-v1","scope":{"endMS":2000,"firstEvent":{"eventMS":999,"sequence":0},"lastEvent":{"eventMS":1002,"sequence":3},"rowCount":4,"startMS":0},"sequence":{"counterPolicy":"zero-based-data-record-index","decoder":{"id":"FixtureCSVDecoder","method":"preserve-all-records-in-original-order-without-sort-repair-or-drop","version":"v1"},"domainId":"FixtureRecordDomain","evidenceRefs":[{"id":"FixtureRawQuotes","sha256":"ed18adb1eec58a7813436df138f83bd84d87f7da0fa47c7ba7b1e1e65635aadf","version":"v1"}],"evidenceState":"asserted","method":"artifact-record-ordinal","rawArtifactRef":{"id":"FixtureRawQuotes","sha256":"ed18adb1eec58a7813436df138f83bd84d87f7da0fa47c7ba7b1e1e65635aadf","version":"v1"}},"snapshotRef":{"id":"FixtureSnapshot","sha256":"91493495c07cc1246a74ae2365ca59d034678719e27cadae446b145f83399f66","version":"v1"},"sourceRef":{"id":"FixtureQuoteSource","sha256":"03ae034f7be0acaccff2c01774e1fbc1699551bf4aeaf91f640dc16986218834","version":"v1"},"version":"v1"}
